{
  "topic": "Custom paragraph",
  "duration_seconds": 36.0,
  "tone": "dramatic",
  "language": "in",
  "title": "",
  "hook": "",
  "scenes": [
    {
      "id": 1,
      "start": 0.0,
      "end": 8.8,
      "voice_text": "Jon Jones was breakin legs on purpose and nobody stopped him. He'd stomp straight down on the knee like killin a bug.",
      "visual_tags": [
        "kickboxing",
        "mma fight",
        "broken legs"
      ],
      "on_screen_text": "Knee Kryptonite"
    },
    {
      "id": 2,
      "start": 8.8,
      "end": 18.0,
      "voice_text": "This vicious oblique kick was banned in old rules. Bader's leg folds Rampage limps forever Gustafsson drops in agony yet refs did nothin.",
      "visual_tags": [
        "oblique kick",
        "mma rules",
        "injury time"
      ],
      "on_screen_text": "Unstoppable Force"
    },
    {
      "id": 3,
      "start": 18.0,
      "end": 25.2,
      "voice_text": "Joe Rogan screamed that should be illegal. But in 2015 the rules flipped and now it's 100% legal.",
      "visual_tags": [
        "joe rogan",
        "mma commentary",
        "rule changes"
      ],
      "on_screen_text": "Legal or Not"
    },
    {
      "id": 4,
      "start": 25.2,
      "end": 32.0,
      "voice_text": "Adesanya Shavkat everyone throws Jon's evil kick to win titles. Smartest move in MMA or pure dirt.",
      "visual_tags": [
        "kickboxing moves",
        "mma strategies",
        "title wins"
      ],
      "on_screen_text": "Savvy Fighter"
    },
    {
      "id": 5,
      "start": 32.0,
      "end": 36.0,
      "voice_text": "Drop a 🔥 if it needs to be banned again",
      "visual_tags": [
        "thumbs down",
        "disapproval",
        "martial arts controversy"
      ],
      "on_screen_text": "Ban It Again"
    }
  ]
}