{
  "topic": "Custom paragraph",
  "duration_seconds": 50.4,
  "tone": "Dramatic",
  "language": "en",
  "title": "",
  "hook": "",
  "scenes": [
    {
      "id": 1,
      "start": 0.0,
      "end": 12.8,
      "voice_text": "Only TWO men in history ever stole a round from Khabib Nurmagomedov… 29 0, 13 0 in the UFC, 40 rounds fought… judges gave the Eagle a 10 9 loss exactly twice.",
      "visual_tags": [
        "octagon",
        "fight statistics"
      ],
      "on_screen_text": "UFC History Made"
    },
    {
      "id": 2,
      "start": 12.8,
      "end": 23.2,
      "voice_text": "First: Conor McGregor, UFC 229 round 3 Conor outstruck him 34 22 and actually defended takedowns for once, so all three judges gave him the round.",
      "visual_tags": [
        "Conor McGregor face",
        "UFC 229 highlights"
      ],
      "on_screen_text": "McGregor's Round One"
    },
    {
      "id": 3,
      "start": 23.2,
      "end": 35.2,
      "voice_text": "Second: Justin Gaethje, UFC 254 round 1  Justin came out swinging, landed clean leg kicks and punches, two judges scored it 10-9 before Khabib choked him out in round 2.",
      "visual_tags": [
        "Justin Gaethje punches",
        "Khabib Nurmagomedov vs Justin Gaethje"
      ],
      "on_screen_text": "Gaethje's Short-Lived Uprising"
    },
    {
      "id": 4,
      "start": 35.2,
      "end": 42.0,
      "voice_text": "That’s it. Two rounds total across 13 UFC fights. Everyone else got completely blanked on the cards.",
      "visual_tags": [
        "UFC fight statistics",
        "empty scorecards"
      ],
      "on_screen_text": "Unbeaten and Unscores"
    },
    {
      "id": 5,
      "start": 42.0,
      "end": 50.4,
      "voice_text": "Khabib didn’t just go undefeated… he damn near went unscored on. Drop a like if that’s the most dominant run ever.",
      "visual_tags": [
        "Khabib Nurmagomedov celebration",
        "dominant run highlights"
      ],
      "on_screen_text": "Dominant Run Unstoppable"
    }
  ]
}